{
  "schema_version": "1.0.0",
  "trip_id": "balkan-roadtrip-2026",
  "updated_at": "2026-07-12T20:30:00+02:00",
  "description": "Samostojna baza znamenitosti in postankov, izpeljana iz activities.json.",
  "attractions": [
    {
      "id": "jajce-st-mary",
      "name": "Cerkev sv. Marije in zvonik sv. Luke",
      "category": "church",
      "country": "Bosna in Hercegovina",
      "city": "Jajce",
      "short_description": "V tej cerkvi je bil leta 1461 kronan zadnji bosanski kralj Stjepan Tomašević. Po osmanski osvojitvi je bila spremenjena v mošejo, pozneje pa je pogorela.",
      "outside_only": false,
      "optional": false,
      "estimated_visit_minutes": 15,
      "data_quality": {
        "has_coordinates": false,
        "has_google_maps_url": false,
        "has_official_url": false,
        "needs_location_enrichment": true,
        "needs_current_info_check": false
      },
      "source_activity_ids": [
        "jajce-kings-waterfall-avnoj"
      ]
    },
    {
      "id": "jajce-fortress",
      "name": "Citadela Jajce",
      "category": "fortress",
      "country": "Bosna in Hercegovina",
      "city": "Jajce",
      "short_description": "Citadela je bila srce zadnje prestolnice srednjeveške Bosne. Z obzidja se odpre pogled na mesto, slap in dolino obeh rek.",
      "outside_only": false,
      "optional": false,
      "estimated_visit_minutes": 30,
      "data_quality": {
        "has_coordinates": false,
        "has_google_maps_url": false,
        "has_official_url": false,
        "needs_location_enrichment": true,
        "needs_current_info_check": false
      },
      "source_activity_ids": [
        "jajce-kings-waterfall-avnoj"
      ]
    },
    {
      "id": "jajce-catacombs",
      "name": "Katakombe",
      "category": "landmark",
      "country": "Bosna in Hercegovina",
      "city": "Jajce",
      "short_description": "Podzemno kapelo in grobnico je v 15. stoletju dal izklesati Hrvoje Vukčić Hrvatinić. Križi, oltar in reliefi so izklesani neposredno v skalo.",
      "outside_only": false,
      "optional": false,
      "estimated_visit_minutes": 20,
      "data_quality": {
        "has_coordinates": false,
        "has_google_maps_url": false,
        "has_official_url": false,
        "needs_location_enrichment": true,
        "needs_current_info_check": false
      },
      "source_activity_ids": [
        "jajce-kings-waterfall-avnoj"
      ]
    },
    {
      "id": "jajce-bear-tower",
      "name": "Medvedji stolp",
      "category": "fortress",
      "country": "Bosna in Hercegovina",
      "city": "Jajce",
      "short_description": "Mogočen obrambni stolp je varoval dostop do zgornjega mesta in kaže na debelino srednjeveškega obrambnega sistema.",
      "outside_only": false,
      "optional": false,
      "estimated_visit_minutes": 10,
      "data_quality": {
        "has_coordinates": false,
        "has_google_maps_url": false,
        "has_official_url": false,
        "needs_location_enrichment": true,
        "needs_current_info_check": false
      },
      "source_activity_ids": [
        "jajce-kings-waterfall-avnoj"
      ]
    },
    {
      "id": "jajce-avnoj",
      "name": "Muzej AVNOJ-a",
      "category": "museum",
      "country": "Bosna in Hercegovina",
      "city": "Jajce",
      "short_description": "V nekdanji sokolski dvorani je 29. in 30. novembra 1943 potekalo drugo zasedanje AVNOJ-a, na katerem so bile začrtane politične osnove povojne federativne Jugoslavije.",
      "outside_only": false,
      "optional": false,
      "estimated_visit_minutes": 40,
      "data_quality": {
        "has_coordinates": false,
        "has_google_maps_url": false,
        "has_official_url": false,
        "needs_location_enrichment": true,
        "needs_current_info_check": false
      },
      "source_activity_ids": [
        "jajce-kings-waterfall-avnoj"
      ]
    },
    {
      "id": "jajce-waterfall",
      "name": "Plivski slap",
      "category": "waterfall",
      "country": "Bosna in Hercegovina",
      "city": "Jajce",
      "short_description": "Na sotočju Plive in Vrbasa voda pada približno 22 metrov globoko. Posebnost je lega skoraj v središču zgodovinskega mesta.",
      "outside_only": false,
      "optional": false,
      "estimated_visit_minutes": 20,
      "data_quality": {
        "has_coordinates": false,
        "has_google_maps_url": false,
        "has_official_url": false,
        "needs_location_enrichment": true,
        "needs_current_info_check": false
      },
      "source_activity_ids": [
        "jajce-kings-waterfall-avnoj"
      ]
    },
    {
      "id": "jajce-old-town",
      "name": "Staro mesto Jajce",
      "category": "landmark",
      "country": "Bosna in Hercegovina",
      "city": "Jajce",
      "short_description": "Ozke kamnite ulice, stare hiše in vsakdanji utrip povezujejo srednjeveško, osmansko, habsburško in jugoslovansko plast mesta.",
      "outside_only": false,
      "optional": false,
      "estimated_visit_minutes": 20,
      "data_quality": {
        "has_coordinates": false,
        "has_google_maps_url": false,
        "has_official_url": false,
        "needs_location_enrichment": true,
        "needs_current_info_check": false
      },
      "source_activity_ids": [
        "jajce-kings-waterfall-avnoj"
      ]
    },
    {
      "id": "sarajevo-bascarsija",
      "name": "Baščaršija",
      "category": "square",
      "country": "Bosna in Hercegovina",
      "region": "Kanton Sarajevo",
      "city": "Sarajevo",
      "google_maps_url": "https://maps.google.com/?q=Bascarsija+Sarajevo",
      "short_description": "Glavna čaršija se je razvijala od 15. stoletja in je bila razdeljena na obrtniške ulice posameznih cehov. Njena osnovna struktura je kljub požarom, vojnam in prenovam ostala prepoznavna.",
      "outside_only": false,
      "optional": false,
      "estimated_visit_minutes": 15,
      "data_quality": {
        "has_coordinates": false,
        "has_google_maps_url": true,
        "has_official_url": false,
        "needs_location_enrichment": true,
        "needs_current_info_check": false
      },
      "source_activity_ids": [
        "sarajevo-heritage-walk"
      ]
    },
    {
      "id": "sarajevo-emperors-mosque",
      "name": "Careva džamija",
      "category": "mosque",
      "country": "Bosna in Hercegovina",
      "region": "Kanton Sarajevo",
      "city": "Sarajevo",
      "google_maps_url": "https://maps.google.com/?q=Careva+džamija+Sarajevo",
      "short_description": "Mošeja je tesno povezana z nastankom Sarajeva. Prvo stavbo je okoli leta 1462 postavil Isa-beg Ishaković, današnja kamnita mošeja pa izvira iz 16. stoletja.",
      "outside_only": false,
      "optional": false,
      "estimated_visit_minutes": 15,
      "data_quality": {
        "has_coordinates": false,
        "has_google_maps_url": true,
        "has_official_url": false,
        "needs_location_enrichment": true,
        "needs_current_info_check": false
      },
      "source_activity_ids": [
        "sarajevo-heritage-walk"
      ]
    },
    {
      "id": "sarajevo-bezistan",
      "name": "Gazi Husrev-begov bezistan",
      "category": "landmark",
      "country": "Bosna in Hercegovina",
      "region": "Kanton Sarajevo",
      "city": "Sarajevo",
      "google_maps_url": "https://maps.google.com/?q=Gazi+Husrev+Beg+Bezistan",
      "short_description": "Pokrita tržnica iz 16. stoletja je bila namenjena prodaji dragocenega blaga. Kamniti oboki in majhne odprtine v kupolah ohranjajo prijetno hladno ozračje, prostor pa svojo trgovsko funkcijo opravlja že skoraj pet stoletij.",
      "outside_only": false,
      "optional": false,
      "estimated_visit_minutes": 10,
      "data_quality": {
        "has_coordinates": false,
        "has_google_maps_url": true,
        "has_official_url": false,
        "needs_location_enrichment": true,
        "needs_current_info_check": false
      },
      "source_activity_ids": [
        "sarajevo-heritage-walk"
      ]
    },
    {
      "id": "sarajevo-ghb-library",
      "name": "Gazi Husrev-begova knjižnica",
      "category": "museum",
      "country": "Bosna in Hercegovina",
      "region": "Kanton Sarajevo",
      "city": "Sarajevo",
      "google_maps_url": "https://maps.google.com/?q=Gazi+Husrev+Beg+Library",
      "official_url": "https://ghb.ba",
      "short_description": "Ena največjih zakladnic pisne dediščine jugovzhodne Evrope hrani več kot sto tisoč knjig, rokopisov in dokumentov v arabščini, turščini, perzijščini in bosanščini v arabici.",
      "outside_only": false,
      "optional": false,
      "estimated_visit_minutes": 30,
      "data_quality": {
        "has_coordinates": false,
        "has_google_maps_url": true,
        "has_official_url": true,
        "needs_location_enrichment": true,
        "needs_current_info_check": true
      },
      "source_activity_ids": [
        "sarajevo-heritage-walk"
      ]
    },
    {
      "id": "sarajevo-gazi-husrev-mosque",
      "name": "Gazi Husrev-begova mošeja",
      "category": "mosque",
      "country": "Bosna in Hercegovina",
      "region": "Kanton Sarajevo",
      "city": "Sarajevo",
      "google_maps_url": "https://maps.google.com/?q=Gazi+Husrev+Beg+Mosque",
      "official_url": "https://begovadzamija.ba",
      "short_description": "Najpomembnejša islamska verska stavba v Bosni in Hercegovini je bila dokončana leta 1531. Zasnoval jo je osmanski glavni arhitekt Adžem Esir Ali, predhodnik Mimarja Sinana. Posebno pozornost namenita šadrvanu, kupoli in minaretu.",
      "outside_only": false,
      "optional": false,
      "estimated_visit_minutes": 25,
      "data_quality": {
        "has_coordinates": false,
        "has_google_maps_url": true,
        "has_official_url": true,
        "needs_location_enrichment": true,
        "needs_current_info_check": true
      },
      "source_activity_ids": [
        "sarajevo-heritage-walk"
      ]
    },
    {